{
  "$schema": "http://json-schema.org/draft-07/schema#",
  "$id": "https://raw.githubusercontent.com/gruncellka/porto-data/refs/heads/main/porto_data/schemas/limits.schema.json",
  "title": "Provider limits schema",
  "description": "Provider-scoped operational limits: how this operator applies service (conflicts, infrastructure, internal policy). Not shared legal sanctions—those live in policy/restrictions.json (country / EU / UN regimes, independent of any single carrier). Each limits file is keyed by provider; regime periods and calendar use the provider operational timezone (see frameworks.timezone, aligned with providers.json for the same provider id).",
  "type": "object",
  "required": [
    "file_type",
    "unit",
    "limits",
    "frameworks"
  ],
  "properties": {
    "$schema": {
      "type": "string",
      "format": "uri",
      "description": "JSON Schema URI reference"
    },
    "file_type": {
      "type": "string",
      "const": "limits",
      "description": "File type identifier"
    },
    "unit": {
      "type": "object",
      "required": [
        "country_code",
        "date"
      ],
      "properties": {
        "country_code": {
          "type": "string",
          "const": "ISO 3166-1 alpha-2"
        },
        "date": {
          "type": "string",
          "const": "ISO 8601"
        }
      },
      "additionalProperties": false
    },
    "limits": {
      "type": "array",
      "items": {
        "type": "object",
        "required": [
          "id",
          "country_code",
          "status",
          "reason",
          "notes",
          "effective_from"
        ],
        "properties": {
          "id": {
            "type": "string"
          },
          "country_code": {
            "type": "string",
            "pattern": "^[A-Z]{2}$"
          },
          "region_code": {
            "type": "string"
          },
          "status": {
            "type": "string",
            "enum": [
              "restricted",
              "limited",
              "prohibited",
              "severe",
              "operational"
            ]
          },
          "reason": {
            "type": "string"
          },
          "description": {
            "type": "string"
          },
          "notes": {
            "type": "string"
          },
          "areas": {
            "type": "object",
            "additionalProperties": {
              "type": "string"
            }
          },
          "entity_type": {
            "type": "string",
            "enum": [
              "country",
              "territory",
              "disputed"
            ]
          },
          "effective_from": {
            "type": [
              "string",
              "null"
            ],
            "format": "date"
          },
          "effective_to": {
            "type": [
              "string",
              "null"
            ],
            "format": "date"
          },
          "partial": {
            "type": "boolean"
          },
          "reference": {
            "type": [
              "string",
              "null"
            ],
            "format": "uri"
          }
        },
        "additionalProperties": false
      }
    },
    "context": {
      "type": "object",
      "description": "Provider-facing narrative only (this limits file’s carrier). Do not use this object to stand in for legal regimes; policy/restrictions.json holds verifiable destination rows and EU/UN-style frameworks.",
      "properties": {
        "national": {
          "type": "object",
          "required": [
            "description",
            "notes"
          ],
          "properties": {
            "description": {
              "type": "string"
            },
            "notes": {
              "type": "string"
            }
          },
          "additionalProperties": false
        }
      },
      "additionalProperties": false
    },
    "frameworks": {
      "type": "object",
      "description": "Operational regime metadata for this provider. Each framework documents the regime time window (effective_from / effective_to, nullable) interpreted in timezone (provider operational calendar—must match providers.<id>.timezone). limits[] row effective_from/effective_to remain authoritative for consumer activation; framework dates are the documented span, usually aligned with the primary limit row.",
      "patternProperties": {
        "^[A-Z0-9_]+$": {
          "type": "object",
          "required": [
            "id",
            "label",
            "description",
            "type",
            "applies_to",
            "effective_from",
            "effective_to",
            "timezone"
          ],
          "properties": {
            "id": {
              "type": "string"
            },
            "label": {
              "type": "string"
            },
            "description": {
              "type": "string"
            },
            "type": {
              "type": "string",
              "enum": [
                "conflict",
                "infrastructure",
                "political"
              ]
            },
            "applies_to": {
              "type": "array",
              "items": {
                "type": "string",
                "pattern": "^[A-Z]{2}$|^ALL$"
              }
            },
            "regions": {
              "type": "array",
              "items": {
                "type": "object",
                "required": [
                  "code",
                  "name"
                ],
                "properties": {
                  "code": {
                    "type": "string"
                  },
                  "name": {
                    "type": "string"
                  }
                },
                "additionalProperties": false
              }
            },
            "note": {
              "type": "string"
            },
            "reference": {
              "type": [
                "string",
                "null"
              ],
              "format": "uri"
            },
            "effective_from": {
              "type": [
                "string",
                "null"
              ],
              "format": "date"
            },
            "effective_to": {
              "type": [
                "string",
                "null"
              ],
              "format": "date"
            },
            "timezone": {
              "type": "string",
              "minLength": 3,
              "pattern": "^[A-Za-z0-9_+-]+(/[A-Za-z0-9_+-]+)+$",
              "description": "IANA zone for this provider’s operational calendar (must match providers.json → providers.<id>.timezone for the limits file’s provider). Used when interpreting framework and limits row effective_* dates."
            }
          },
          "additionalProperties": false
        }
      },
      "additionalProperties": false
    }
  },
  "additionalProperties": false
}
